<?xml version="1.0" encoding="UTF-8"?>
<xs:schema xmlns:xs="http://www.w3.org/2001/XMLSchema">
	<xs:element name="elementos">
		<xs:complexType>
			<xs:sequence>
				<xs:element name="elemento" maxOccurs="unbounded">
					<xs:complexType>
						<xs:sequence>
							<xs:element name="nombre" type="xs:string" />
							<xs:element name="color" type="xs:string" />
							<xs:element name="masa" type="xs:string" />
						</xs:sequence>
						<xs:attribute name="codigo" use="required" />
					</xs:complexType>
				</xs:element>
			</xs:sequence>
		</xs:complexType>
	</xs:element>
</xs:schema>